{
  "id": 4,
  "name": "Hill fort",
  "realm": "goblin_hills",
  "kind": "siege",
  "worldW": 540,
  "shots": 4,
  "hints": [
    "Kill 3 in 2 seconds for a MASH combo."
  ],
  "scoreTarget": 3000,
  "escapeLimit": 1,
  "exit": {
    "x": 520,
    "y": 307
  },
  "blocks": [
    {
      "m": "stone",
      "x": 222,
      "y": 306,
      "w": 12,
      "h": 28
    },
    {
      "m": "stone",
      "x": 262,
      "y": 306,
      "w": 12,
      "h": 28
    },
    {
      "m": "stone",
      "x": 302,
      "y": 306,
      "w": 12,
      "h": 28
    },
    {
      "m": "wood",
      "x": 262,
      "y": 289,
      "w": 100,
      "h": 6
    },
    {
      "m": "wood",
      "x": 232,
      "y": 276,
      "w": 6,
      "h": 20
    },
    {
      "m": "wood",
      "x": 262,
      "y": 276,
      "w": 6,
      "h": 20
    },
    {
      "m": "wood",
      "x": 292,
      "y": 276,
      "w": 6,
      "h": 20
    },
    {
      "m": "wood",
      "x": 262,
      "y": 263,
      "w": 80,
      "h": 6
    },
    {
      "m": "stone",
      "x": 240,
      "y": 254,
      "w": 12,
      "h": 12
    }
  ],
  "monsters": [
    {
      "t": "goblin_bomber",
      "x": 242,
      "y": 313
    },
    {
      "t": "goblin_bomber",
      "x": 282,
      "y": 313
    },
    {
      "t": "goblin_grunt",
      "x": 270,
      "y": 253
    },
    {
      "t": "goblin_grunt",
      "x": 292,
      "y": 253
    },
    {
      "t": "goblin_grunt",
      "x": 190,
      "y": 313
    },
    {
      "t": "skeleton_runner",
      "x": 340,
      "y": 313,
      "dir": 1,
      "speed": 0.8
    },
    {
      "t": "skeleton_runner",
      "x": 362,
      "y": 313,
      "dir": 1,
      "speed": 0.7
    }
  ]
}